{
    "id": 20,
    "date": "2023-04-19T06:37:33",
    "date_gmt": "2023-04-19T06:37:33",
    "guid": {
      "rendered": "http://localhost/index.php/2023/04/19/my-block-rogerpp-8/"
    },
    "modified": "2023-04-19T06:37:33",
    "modified_gmt": "2023-04-19T06:37:33",
    "slug": "my-block-rogerpp-8",
    "status": "publish",
    "type": "wp_block",
    "link": "http://localhost/index.php/2023/04/19/my-block-rogerpp-8/",
    "title": {
      "raw": "My Block rogerpp"
    },
    "content": {
      "raw": "[my-blockpp]",
      "protected": false
    },
    "template": "",
    "_links": {
      "self": [
        {
          "href": "http://localhost/index.php/wp-json/wp/v2/blocks/20"
        }
      ],
      "collection": [
        {
          "href": "http://localhost/index.php/wp-json/wp/v2/blocks"
        }
      ],
      "about": [
        {
          "href": "http://localhost/index.php/wp-json/wp/v2/types/wp_block"
        }
      ],
      "version-history": [
        {
          "count": 0,
          "href": "http://localhost/index.php/wp-json/wp/v2/blocks/20/revisions"
        }
      ],
      "wp:attachment": [
        {
          "href": "http://localhost/index.php/wp-json/wp/v2/media?parent=20"
        }
      ],
      "curies": [
        {
          "name": "wp",
          "href": "https://api.w.org/{rel}",
          "templated": true
        }
      ]
    }
  }